query,query_type,tool_needed,tool_name
"Hey, can u tell me how much is Ethreum cost now? I think the symbol is ETH, right? thx",hard,True,fetch_crypto_price
"Can you please send an email to john.doe@example.com with the subject ""Project Update"" and the body ""Hi John, just checking in to give you an update on the project status. Let me know if you have any questions.""?",easy,True,send_email
"Please send an email to john@example.com with the subject ""Project Update"" and let him know that the meeting is scheduled for Friday at 2 PM.",easy,True,send_email
"Can you send an email to john.doe@example.com with the subject ""Project Update"" and the body ""Hi John, just checking in on the project status. Let me know if you need anything from my side.""?",easy,True,send_email
"Can you send an email to john.doe@example.com with the subject ""Meeting Update"" and the body ""The meeting has been rescheduled to Friday at 3 PM.""?",easy,True,send_email
"Can you send an email to john.doe@example.com with the subject ""Meeting Update"" and the message ""The meeting has been rescheduled to 3 PM tomorrow""?",easy,True,send_email
"uhm, can you pls send a emial to my project manager (jane.doe@example.com) and also I think its about the milestone report due tmrw? Can you like, do that? The body should be like 'Hi, just checking in - will the milestone report be ready for tomorrow?' thanks",hard,True,send_email
"I need sum1 to get a note about my meeting moved to tommorow, can u send a email to john.smithe@example, change the subject to ""Meeting moved"" adn say in the body its now on Friday at 10?",hard,True,send_email
"hey can u send email to john.doe@example.com , ask him about our meeting time on thursday? also im not sure about the subject, maybe Meeting time? dont make it too formal pls. thx",hard,True,send_email
hey can u send an email with the tittle meeting and say it wil start at 2pm to john@example.com plz??,hard,True,send_email
"hey i need to email my boss quick (jane.doe@example.com), just say ""i'm running late"". wats the subject line and how do i send it?",hard,True,send_email
"Can you send a ""Daily Standup starts now!"" message to the #team-updates channel on Slack?",easy,True,send_slack_message
"Can you send a message to the #general channel on Slack saying ""Team meeting at 2 PM today""?",easy,True,send_slack_message
"Can you send a message to the #marketing channel saying ""The meeting starts in 10 minutes""?",easy,True,send_slack_message
"Can you send the message ""Team meeting starts in 10 minutes!"" to the #general Slack channel?",easy,True,send_slack_message
"Can you send a message to the #team-updates channel saying ""The project deadline has been moved to next Friday""?",easy,True,send_slack_message
"umm I need to tell Sarah in slack that the meeting is cancelled, dm her directly, can you help?",hard,True,send_slack_message
"Hey, um, how do I tell #enginnerrng the deploy failed at 2am improvemetns needed psot-pone, can u send that in slack?",hard,True,send_slack_message
can u pls remind #marketing-team 2 update their report by tmrw?,hard,True,send_slack_message
"can u send me a msg in slack channel called #general with the text ""team meeting at 3pm""? thx",hard,True,send_slack_message
can u pls send message to #setup-team saying sorry about the late reply i just saw this?,hard,True,send_slack_message
"Please post the following message to Twitter: ""Excited to share our latest update with everyone!""",easy,True,post_to_x
"Please post the following message to X: ""Excited to announce our new product launch today! #NewRelease""",easy,True,post_to_x
"Please post the following message to X: ""Excited to share my latest project with everyone! 🚀 #NewBeginnings""",easy,True,post_to_x
"Please post the following message to X for me: ""Excited to launch our new project today! Stay tuned for updates.""",easy,True,post_to_x
"Please post the following message to X: ""Excited to share my latest project with everyone! #NewBeginnings""",easy,True,post_to_x
"hey, can u hlep me figure out how do i send a tweet about my dog using this tool? what should i put in the message?",hard,True,post_to_x
"hey so can you tweet s/thing like friday's been so long,, is it just me? (pls add a pizza emoji at ther end)",hard,True,post_to_x
"can u send a tweet saying ""Just tried the new pizza place, soooo good!""?",hard,True,post_to_x
"hey, cud u send ""Happy Birtday to my best freind!"" to twitter?",hard,True,post_to_x
"hey can u post this: ""Had pancakes for dinner lol #breakfastfordinner"" to my X?",hard,True,post_to_x
"Can you schedule a meeting called ""Team Sync"" for June 20, 2024, at 2:00 PM at the main conference room?",easy,True,create_event
Can you add a meeting with the team for next Thursday at 3pm in the main conference room to my calendar?,easy,True,create_event
"Can you add a meeting titled ""Project Update"" for June 30th at 2pm at the downtown office?",easy,True,create_event
"Can you schedule a meeting titled ""Project Kickoff"" for June 20, 2024, at 2:00 PM at the main office?",easy,True,create_event
Can you add a meeting with Sarah at the office tomorrow at 3pm to my calendar?,easy,True,create_event
Hey how can i make a new event in my calendar for tomorrows team meet at 2pm in meeting room B?,hard,True,create_event
"hey i need to put a borthday party for my friend on calender. its on July 14th 6pm, um could you create it? oh and its at his house, thanks!",hard,True,create_event
umm can u make a calender thing for meetin w/ Sarah at teh cafe next friday at 2pm?,hard,True,create_event
i wanna rember when is moms birthday paryt on jun 15 at 6pm. her house,hard,True,create_event
"i wanna set up a mtg with Bob at new office next friday at 2pm, can u make the event?",hard,True,create_event
Remind me to call the doctor tomorrow at 10 AM.,easy,True,set_reminder
Please remind me to call my doctor tomorrow at 10 AM.,easy,True,set_reminder
Remind me to call my dentist at 3pm tomorrow.,easy,True,set_reminder
Remind me to call my doctor tomorrow at 10:00 AM.,easy,True,set_reminder
Can you remind me to call the dentist tomorrow at 10am?,easy,True,set_reminder
"im always forgetting to call my mom, can u set a rmeinder for me to phone her next tuesday at like in the evening?",hard,True,set_reminder
remind me for my moms birthday on July 8th but uhhh i dont remember what ISO format is so just put it at like 10am in the morning pls,hard,True,set_reminder
can you help me remind me about my moms birthday on 10th june?,hard,True,set_reminder
"hey i got i haveeee to call my mom omorrow at 8, can u rmeind me?",hard,True,set_reminder
Remind me too take out the traash tmrw at 8 in th morning,hard,True,set_reminder
Can you remind me to call the dentist tomorrow?,easy,True,add_to_todo_list
"Can you add ""buy groceries"" to my to-do list?",easy,True,add_to_todo_list
"Can you add ""do laundry"" to my to-do list?",easy,True,add_to_todo_list
"Can you add ""get gas"" to my to-do list?",easy,True,add_to_todo_list
"Can you add ""call the vet for Max's appointment"" to my to-do list?",easy,True,add_to_todo_list
"umm can u put ""get car fixd"" in my tasks? thx",hard,True,add_to_todo_list
umm i need to rember to call mom l8r can u put that on my todo list?,hard,True,add_to_todo_list
"uhm i have to call my mum abt her birthday, can u put that on my totdo list plz",hard,True,add_to_todo_list
"i keep froggeting, can u add ""buy grocries"" to my todo?",hard,True,add_to_todo_list
"hey, can u plz put 'call mom n remind her about the dr appointmant' on my todo list? thanks!",hard,True,add_to_todo_list
What are the latest travel restrictions for US citizens visiting Japan?,easy,True,web_search
What is the latest news about the Artemis II mission?,easy,True,web_search
What is the latest news about electric vehicle battery technology in 2024?,easy,True,web_search
What are the latest headlines about renewable energy developments this week?,easy,True,web_search
What are the latest news headlines about electric vehicles this week?,easy,True,web_search
"when did ladt season stranger things come out, and is there a new one coming soon?",hard,True,web_search
whats the weather like in madrid tormorow?,hard,True,web_search
whta year did barack obamma win his first presidential election?,hard,True,web_search
what’s the latest news abot web3 tech in 2024?,hard,True,web_search
"wahts the lastest news abuot african cup of nations, who won this year?",hard,True,web_search
"Find all pages related to ""marketing plan"" in the Notion workspace.",easy,True,notion_search
Can you find my meeting notes from last week in my Notion workspace?,easy,True,notion_search
Can you find my notes about the marketing strategy in our Notion workspace?,easy,True,notion_search
"Can you find the Notion page titled ""2024 Marketing Plan""?",easy,True,notion_search
"Can you find pages in our Notion workspace that mention ""quarterly marketing plan""?",easy,True,notion_search
where did i put taht meeting notes from last thurdsday in my notion?,hard,True,notion_search
"i think i made a ""Work Plan"" page last month but cant rember the exact name. can u check notion for ""work plan"" or similar?",hard,True,notion_search
what was the meeting notes aboit project x in april?,hard,True,notion_search
"can u check if i have a page in notion about ""health projects"" or maybe ""healthproject"" with no space? I cant quite remmber the excact title",hard,True,notion_search
do we got a nots page abot team branstormin sesion last weak?,hard,True,notion_search
What is the process for submitting a travel expense claim?,easy,True,retrieve_data
What is the current vacation policy for employees?,easy,True,retrieve_data
What is the process for submitting a travel reimbursement request?,easy,True,retrieve_data
Where can I find the latest guidelines for remote work in our company?,easy,True,retrieve_data
What is the process for requesting a laptop replacement?,easy,True,retrieve_data
"how do u submit expnses for trips, cant find the link??",hard,True,retrieve_data
"hey, um, where do you find the thing for getting id badge when ur new here? i didnt get mine yet and i dunno if theres a form or something?",hard,True,retrieve_data
hey uh how do i file for expenc reimbursement again? where do i send my forms and what is the policy?,hard,True,retrieve_data
um im have a issue i need to send my laptop to IT for fixing but do i need to fill out a form first or just hand it in? how do i start this process,hard,True,retrieve_data
plz how do i get my reimbursements back? forgot process,hard,True,retrieve_data
What is the average sale amount from the sales table?,easy,True,query_database
What is the total sales value for last month?,easy,True,query_database
What is the total number of customers in the database?,easy,True,query_database
What is the total number of sales made in the last month?,easy,True,query_database
What is the total sales amount for last month?,easy,True,query_database
uhh can u check in saless table for the totle sales amount where product_name is wrnogly typed as “iphon” not “iphone”? speling matters!,hard,True,query_database
how many cutomers bought something lasy month?,hard,True,query_database
Can u tell me how many customers are named 'john' in the custmers table?,hard,True,query_database
Can you tel me how many sales we had last month? I want the exact count pls.,hard,True,query_database
whats the averge price for itmes in the inventory?,hard,True,query_database
"Can you make me a 12-character password with numbers, symbols, and uppercase letters?",easy,True,generate_password
"Can you create a 12-character password for me that includes symbols, numbers, and uppercase letters?",easy,True,generate_password
Can you create a random 12-character password that includes both uppercase letters and symbols?,easy,True,generate_password
"Can you create a 12-character password for me that uses symbols, numbers, and uppercase letters?",easy,True,generate_password
"Can you make me a password that's 12 characters long, includes uppercase letters and numbers, but no symbols?",easy,True,generate_password
"hey i needa password for my new training acc, like 13 charcters i want numbers and symbols but dont use capital letters thx",hard,True,generate_password
cna yu make pasword like 17 letter long with out any simbols but use numers and caps?,hard,True,generate_password
"i need a pasword that’s about 15 characters,,, should I include symbols? maybe numbers and big letters would be good too. can you help me do that",hard,True,generate_password
"i need to mak a passwrod for my new email. can you do like 10 letters, with caps and number but no symbold pls",hard,True,generate_password
"hey, can u make mea new passwrd thats strong? i want like 14letters, use upprcase, symbls and some numbers plz",hard,True,generate_password
