query,query_type,tool_needed,tool_name
How many ways can I choose 4 items from a set of 10?,easy,True,calculate_combinations
How many different ways can I choose 3 items from a group of 8?,easy,True,calculate_combinations
how many ways cn i chose 5 itemss from 14?,hard,True,calculate_combinations
"hi, okay so i got a group of 9 people and i wanna figure out how many different teams of 5 i can make. how many combinations would that be? i’m not so good at math, sorry.",hard,True,calculate_combinations
"Hey, so if i have 12 things and I wanna pick 7, how many combos is that? Thx!",hard,True,calculate_combinations
"if i have a group of 10 peaple and need to pick 4, how many combos?",hard,True,calculate_combinations
"i have 10 books and want to pick 3 but its late and i forgot how many ways i can pick em, can you tell how many combos?",hard,True,calculate_combinations
"What will my federal income tax be in 2025 if I earn $78,500?",easy,True,calculate_tax
"What is the federal income tax for someone earning $60,000 in 2025?",easy,True,calculate_tax
"What will my federal income tax be if I make $85,000 in 2025?",easy,True,calculate_tax
"How much federal income tax would I owe in 2025 if my income is $90,000?",easy,True,calculate_tax
"What will my federal income tax be if I make $85,000 in 2025?",easy,True,calculate_tax
"um, hi. i earned like 47,000 dollarz this year, can u tell me how much taxes i gotta pay?? i think its for like 2025? thanks",hard,True,calculate_tax
"hey, can u tell me how much tax someonw would pay if they make 84000 this year? just wanna b sure im using the right numbers lol thx",hard,True,calculate_tax
"hi sorry, my income this year was about 55000 how much will  i pay for tax?",hard,True,calculate_tax
"if I make 71,340 usd in 2025, hw much tax do i need to pay?",hard,True,calculate_tax
"hi, im trying to plan for next year, how much taxes I ow on an income of 58500?",hard,True,calculate_tax
What date will it be 30 days after 2024-07-01?,easy,True,add_days_to_date
What date will it be 15 days after 2024-07-01?,easy,True,add_days_to_date
What date will it be 75 days after 2024-03-12?,easy,True,add_days_to_date
What is the date 50 days after 2024-07-01?,easy,True,add_days_to_date
What date will it be 45 days after 2024-02-10?,easy,True,add_days_to_date
"uh if I have like 2023-11-30 and I addd 8 days, wut date will that be?",hard,True,add_days_to_date
"hi, if my birthday is 2023-07-14 and I add 47 days, what dat willl it end up?",hard,True,add_days_to_date
hey can u tell me wat date it will be if i add 30 days to 2023-07-14?,hard,True,add_days_to_date
Can yo upls tell whats the date if i add 40 days to 2022-06-01?,hard,True,add_days_to_date
"ok so if i got like ""2023-10-12"" an I want to knw what date is it gonna be 45 days later, how do I figure that without messin the months up??",hard,True,add_days_to_date
What day of the week was 2024-02-14?,easy,True,get_weekday_from_date
What day of the week was 2022-09-15?,easy,True,get_weekday_from_date
What day of the week was 2021-10-31?,easy,True,get_weekday_from_date
What day of the week was 2023-11-15?,easy,True,get_weekday_from_date
What day of the week was 2022-10-15?,easy,True,get_weekday_from_date
"hey, what day of the weeek was 2023-12-13 ??",hard,True,get_weekday_from_date
waht day of week was it on 2019-7-15?,hard,True,get_weekday_from_date
"hi, I went to the doctor on 2022-10-05, but I forgot what day it was (like Monday, Tuesday, etc). can u tell me what weekday that was? tx",hard,True,get_weekday_from_date
whats the weekday on 2022/7/20 ?,hard,True,get_weekday_from_date
what day is it for 2031-01-07 pls?,hard,True,get_weekday_from_date
What time is 2024-07-10T15:00:00 in America/New_York if it is in UTC?,easy,True,convert_time_zone
What is 2024-06-12T15:00:00 in America/New_York if it's currently given in UTC?,easy,True,convert_time_zone
What is 2024-07-01T15:00:00 in Asia/Tokyo if it's originally in UTC?,easy,True,convert_time_zone
What is 2024-06-24T14:00:00 from UTC converted to America/New_York time?,easy,True,convert_time_zone
What is 2024-06-15T14:00:00 in America/New_York time if it's currently in UTC?,easy,True,convert_time_zone
Hey can u tell me what time it will be in la if its 2024-05-23T18:30:00 in tokyo?,hard,True,convert_time_zone
"hey i got a meeting at 2024-07-15T14:00:00 in UTC and need to know what time it'll be in tokyo, can you help?",hard,True,convert_time_zone
i got a call its at 2024-07-01T15:30:00 in UTC so like what time is it in los angeles?,hard,True,convert_time_zone
what time isit if its 2024-06-27T10:30:00 in utc? i need new york time plz.,hard,True,convert_time_zone
"im in berlin and got a call set for 2024-07-12T13:15:00Z, wt time should I join?",hard,True,convert_time_zone
How many days are there between 2023-11-15 and 2024-02-28?,easy,True,calculate_date_diff
How many days are there between 2023-10-12 and 2024-03-27?,easy,True,calculate_date_diff
How many days are there between 2023-08-15 and 2024-03-10?,easy,True,calculate_date_diff
How many days are there between 2022-12-01 and 2023-01-15?,easy,True,calculate_date_diff
How many days are there between 2023-01-01 and 2023-03-15?,easy,True,calculate_date_diff
Hy... can u pls tell me how many days is it between 2022-6-15 and 2023-07-01? thx,hard,True,calculate_date_diff
how many days has it been since 2022/07/15 to now?,hard,True,calculate_date_diff
uhh what’s the days between 2022-4-8   and 2023-5-2?,hard,True,calculate_date_diff
How many days is it between 2021 07 15 and 2021-09-10?,hard,True,calculate_date_diff
"uhm, if i got a date 2023-11-15 and another one, 2024-01-08, can u tell me how many days is that?",hard,True,calculate_date_diff
What is the Unix timestamp for 2022-08-15?,easy,True,get_unix_timestamp
What is the Unix timestamp for 2001-09-11?,easy,True,get_unix_timestamp
What is the Unix timestamp for 2023-12-15?,easy,True,get_unix_timestamp
What is the Unix timestamp for 2023-11-15?,easy,True,get_unix_timestamp
What is the Unix timestamp for 2001-09-11?,easy,True,get_unix_timestamp
what is the unix timstamp for 2002-11-25?,hard,True,get_unix_timestamp
uhh is it possible to get the unix time-stamp for 1999/12/31?,hard,True,get_unix_timestamp
i got a date like 2023-17-12 ... can u tell me the unix stamp for it?,hard,True,get_unix_timestamp
Can u tell me what is th unix timestamp for 2018-9-7?,hard,True,get_unix_timestamp
whats the unix time for 24-07-2022?,hard,True,get_unix_timestamp
What is the current date and time?,easy,True,get_current_datetime
What is the current date and time right now?,easy,True,get_current_datetime
What is the current date and time right now?,easy,True,get_current_datetime
What is the current date and time right now?,easy,True,get_current_datetime
What is the current date and time right now?,easy,True,get_current_datetime
wht day is it 2day?,hard,True,get_current_datetime
what day is it today and also the time right now?,hard,True,get_current_datetime
"um, what day and time is it rn?",hard,True,get_current_datetime
what date an tme is it rite now?,hard,True,get_current_datetime
um what time is it now in yr system?,hard,True,get_current_datetime
"Can you reverse the order of this list for me: [5, 10, 15, 20, 25]?",easy,True,reverse_list
"Can you reverse the order of the following list for me: [1, 3, 5, 7, 9]?",easy,True,reverse_list
"Can you reverse the order of this list for me: [apple, banana, cherry, date]?",easy,True,reverse_list
"Can you show me the list [""dog"", ""cat"", ""mouse""] in reverse order?",easy,True,reverse_list
"Can you reverse this list for me: [apples, bananas, cherries, dates]?",easy,True,reverse_list
"hwy do i make [21,8,6] go backwards list?",hard,True,reverse_list
"hey, can you flip this [dog,cat,fish,mouse,horse] around thx",hard,True,reverse_list
"heyy can u turn [apple,banana,peach] backwards for me pls? i wanna see the order reversed but i dont wanna do it myself..",hard,True,reverse_list
"hey, I got this shoppinglist: [bread, eggs, cheese, milk, butter] but I need it in backwards order lol. can u help?",hard,True,reverse_list
"hey um can u flip these backwards: [7, 'dog', 2.4, 'apple', 10]?",hard,True,reverse_list
"Can you remove duplicates from this list: [""apple"", ""banana"", ""apple"", ""orange"", ""banana""]?",easy,True,deduplicate_list
"Here is a list with some duplicate items: [""apple"", ""banana"", ""apple"", ""orange"", ""banana""]. Can you remove the duplicates for me?",easy,True,deduplicate_list
"Can you remove all duplicate values from this list: [""apple"", ""banana"", ""apple"", ""orange"", ""banana"", ""grape""]?",easy,True,deduplicate_list
"Can you remove the duplicates from this list: [apple, banana, apple, orange, banana]?",easy,True,deduplicate_list
"I have a list with repeated items: [""apple"", ""banana"", ""apple"", ""orange"", ""banana""]. Can you give me the list without any duplicates?",easy,True,deduplicate_list
"I have this list: [a, b, c, a, a, b, d] can yu tell wich items are only there once? Thnx!",hard,True,deduplicate_list
"hiy. can you deduplicate this lisT for me: [“apple”, “banana”, “apple”, “grape”, “banana”, “pear”,“grape”]? thx",hard,True,deduplicate_list
"hey i have a list like [apple,banana,apple,orange,banana] can you dedup it for me ?",hard,True,deduplicate_list
"i got like 3 ""cat"" and 2 ""dog"" in my list [""cat"", ""dog"", ""cat"", ""bird"", ""dog""]. can u deduplicate it?",hard,True,deduplicate_list
"My shoppingg list: [""milk"",""bread"",""eggs "",""cheese"",""bread "",""milk""] – Can u make it dont have copy things on it?",hard,True,deduplicate_list
"Can you arrange these numbers [34, 7, 23, 89, 1] from largest to smallest?",easy,True,sort_list
"Can you sort the list [32, 4, 15, 8] in ascending order?",easy,True,sort_list
"Can you put these numbers in order from biggest to smallest: [15, 3, 42, 8, 27]?",easy,True,sort_list
"Can you sort this list of numbers [14, 3, 27, 8] in descending order?",easy,True,sort_list
"Can you sort the following numbers in descending order: [5, 12, 3, 19, 8]?",easy,True,sort_list
"hey, i got a list of numers: [5, 2, 9, 1, 7], can u help me put them in acending order?? Thanks",hard,True,sort_list
"Hey, um, I have numbers like [12, 4, 22, 9]. how do i get them al from kleinest to the most? Not sure which to set for descending for that, can you do it?",hard,True,sort_list
"can u put thiiss [3,1,4 2,9 ] in order for me? I want it like lowest to bigest, thx!!",hard,True,sort_list
"hey i have this list [7,2,9,1] how do i get it show up biggest to smallest?",hard,True,sort_list
"hey i have a list 4, 7, 2, 11, 5 can u put it from bigest to smalest? thx",hard,True,sort_list
"Which numbers from this list [3, 8, 15, 22, 6] are greater than 10?",easy,True,filter_list
"Which numbers in this list [2, 8, 15, 23, 7] are greater than 10?",easy,True,filter_list
"Can you show me all the numbers greater than 50 from this list: [12, 67, 34, 89, 23, 51]?",easy,True,filter_list
"Which numbers in the list [3, 7, 12, 15, 22] are greater than 10?",easy,True,filter_list
"Which numbers from this list are even: [3, 6, 8, 11, 14]?",easy,True,filter_list
"can u get me from [14, 9, 22, 7] only them what is lesser then 15?",hard,True,filter_list
"i got this list [3,'a',12,5.5,25,""hello""] an want only numbers biger than ten, how du I do it?",hard,True,filter_list
"loooked at my liist, can u get only values that are not even numbers? pls filter these [12, 7, 24, 3, 9, 18]",hard,True,filter_list
"hi i have a big list of these nums [24, 7, 32, 8, 9, 3, 19, 14] and want just the ones over ten plz.",hard,True,filter_list
"hey i got a list like [2, 9, 15, 7, 20, 3] and i just want the numbers bigger than 8. waht do i put for the condition thing?",hard,True,filter_list
"How many words are in the sentence ""The quick brown fox jumps over the lazy dog""?",easy,True,word_count
"How many words are in the sentence ""Artificial intelligence is transforming the world""?",easy,True,word_count
"How many words are in the sentence ""The quick brown fox jumps over the lazy dog""?",easy,True,word_count
"How many words are in the sentence ""Learning is a lifelong journey""?",easy,True,word_count
"How many words are there in: ""Success is not final, failure is not fatal""?",easy,True,word_count
"how many word are in : ""The quick brown fox jumped over thr fence""",hard,True,word_count
Can u tell me hw many words are in this:  I really enjoyed the movie last night! It was super fun and exciting :),hard,True,word_count
how man words in this?: The quick broown fox jumps ovver the lazy doog,hard,True,word_count
How many words are there in this text:  quick brown fox jumps over lazy the dog,hard,True,word_count
"um so like, how many words r in this sentance: The quick brown fox jumps over the lazy dog & the cat too?",hard,True,word_count
"How many times does the letter ""e"" appear in the sentence ""Never underestimate the power of teamwork""?",easy,True,char_count
"How many times does the letter ""e"" appear in the sentence ""Here is an example text for counting""?",easy,True,char_count
"How many times does the letter ""e"" appear in the sentence ""Here is a simple example""?",easy,True,char_count
"How many times does the letter ""e"" appear in the sentence ""Experience is the best teacher""?",easy,True,char_count
"How many times does the letter ""e"" appear in the sentence ""Experience is the best teacher""?",easy,True,char_count
"hey, uhm... how many t's are there in ""Letter to the Editor""?",hard,True,char_count
how many times does the letter e apears in The quick brown fox jumps over the lazy dog,hard,True,char_count
"Hey, uh, can you tell me how many letter ""o"" in this sentence: ""Look out for the owls on the oak tree.""? Thx",hard,True,char_count
"how mny times does the ltr 'r' apear in ""Rainy roads are rarely realy red""?",hard,True,char_count
can u tell me how many t is in: The letter t is interesting aaand sometimes ttricky,hard,True,char_count
"Can you turn the phrase ""Summer Sale 2024: Up to 50% Off!"" into a URL-friendly slug?",easy,True,slugify_text
"Can you convert ""Ice Cream & Waffle Party!"" into a URL-friendly slug?",easy,True,slugify_text
"Could you turn ""Hello, World! Welcome to AI."" into a URL slug for me?",easy,True,slugify_text
"Can you convert the phrase ""Hello, World! Let's Go."" into a URL-friendly slug?",easy,True,slugify_text
"Can you turn ""Hello, World! Welcome to 2024."" into a URL-friendly slug?",easy,True,slugify_text
hey can you slugify '  Hello World! This is 2024. ' pls,hard,True,slugify_text
"hey can u make slug from  ""This is my first BLOG post!!!"" pls",hard,True,slugify_text
"hey, i need a link for ""CrAzY Deals 2024!!"" but it need to be like, url frendy, can u help?",hard,True,slugify_text
"hey can u make a slug of ""Best Ways to Cook Eggs""?",hard,True,slugify_text
"Hi, can u please slugify this title:  ""New Product Launch!!! Exciting Times@2024"" Thanks",hard,True,slugify_text
"Can you extract all the hashtags from this sentence: ""Loving the vibes at the beach! #summer #sun #fun""?",easy,True,extract_hashtags
"Can you show me all the hashtags in this sentence: ""Enjoying the sunny day at the beach! #summer #vacation #relax""?",easy,True,extract_hashtags
"Can you pull out all the hashtags from this sentence: ""We're excited for the #SummerFest2024! Don't miss it! #FunTimes #FamilyEvent""?",easy,True,extract_hashtags
"What hashtags are in the sentence ""Excited for our summer trip! #vacation #beach #fun""?",easy,True,extract_hashtags
"Can you show me all the hashtags in this sentence: ""We love #pizza and #FridayNights with good friends!""?",easy,True,extract_hashtags
"hey, um I'm tryin to fin the hash tags in this post: ""Can u beleive #summer is finaly here?! #Excited #vacayplans2024 :)"" what are all of them ?",hard,True,extract_hashtags
"hey, umm can u pull out the hash tags from this for me? i have this post: ""Spending Sunday with the family! #weekendvibes #relax #famTime""",hard,True,extract_hashtags
"can u find me all #hashtags in this post: ""had a great day out! #sun #happy #weekendfun lets do it again""",hard,True,extract_hashtags
"hey i saw this post on twitter: Wow! I can’t believe it, amazing results!! #growth #Success #HustlemodeON :) can you get me the hashtags pls",hard,True,extract_hashtags
"can u pull out all the happhtags from this txt: I love #coding, #python and #AI so much!",hard,True,extract_hashtags
"Can you list all the URLs found in this paragraph?

""Here are some resources to check out: https://www.example.com, find documentation at http://docs.resource.org, and our blog is at https://blog.site.net for updates.""",easy,True,extract_urls
"Can you show me all the URLs found in this paragraph: ""Check out our new site at https://www.example.com or contact us via http://help.example.com/support. For more info, visit www.info.com""?",easy,True,extract_urls
"Can you show me all the URLs found in this paragraph: ""For more information, visit https://openai.com or check our documentation at http://docs.openai.com/help.""?",easy,True,extract_urls
"Can you list all the URLs found in this paragraph? ""Visit https://example.com for info, and check our blog at http://blog.example.org/latest.""",easy,True,extract_urls
"Can you show me all the links mentioned in this paragraph? ""Check out our homepage at https://www.example.com or follow us on social platforms like http://twitter.com/example.""",easy,True,extract_urls
can u plz pull out allthe links form this txt? i think there r few but i cant spot all. thnx!,hard,True,extract_urls
"hey i got an old email fulla links but i cant spot em all. can u find every url in this mess: ""check out https://myweb.com, and also http://info.net/page and dunno if www.stillgood.org works""?",hard,True,extract_urls
"hey i got an emial with a bunch of links in it but i cant really see all of them together. can u help me find every link from this text below?

Hey! Check out these sites: https://example.com, and don't forget our portal at portal.company.com/login. Also, the docs are at http://docs.example.com, and maybe see ftp://files.example.com too, kthx.",hard,True,extract_urls
"hey .. i need to list all the urls in this paragraph. Can you help me with that ok ?? ""Check out our site at www.example.com, or visit https://docs.test.com for docs. Also, you can see more info at http:invalid.com/info,.""",hard,True,extract_urls
"Hey i have this message someone sent me: ""Check out https://www.latestnews.com and also visit http:/special-offers.biz for cool stuff"" Can you tell me all the links in it?",hard,True,extract_urls
Is john.doe@example.com a valid email address format?,easy,True,validate_email
"Is ""carla.smith@domain.co"" a valid email address format?",easy,True,validate_email
"Is the email address ""someone@example.com"" in a valid format?",easy,True,validate_email
"Is ""janedoe@mydomain.com"" a valid email address format?",easy,True,validate_email
Is the email address maria.smith@sample.org formatted correctly?,easy,True,validate_email
"hey, can u check if this email is right? john.doe@@gmail.com

thanks",hard,True,validate_email
"is jenny_234@gmail,com a real email format?",hard,True,validate_email
"hey im not sure if this one is right but can u check if john.doe@website,com is a valid email adress?",hard,True,validate_email
hey ive got a mail like anna@@gmailcom can you check if its correct?,hard,True,validate_email
is this email rite: john.smith at gmail? pls check if its ok for emails,hard,True,validate_email
"Here is a human-like query suited for the extract_phone_number tool:

Can you find and list the phone numbers in this message? ""You can reach us at 555-1234 or (800) 222-3456 during business hours.""",easy,True,extract_phone_number
"Can you extract the phone number from this message: ""Hi, please call me at (555) 123-4567 when you get a chance""?",easy,True,extract_phone_number
"Can you find the phone number in this message: ""Please call me at (555) 123-4567 when you get the chance""?",easy,True,extract_phone_number
"Can you find all phone numbers in this text: ""Contact us at 555-1234 or (800) 999-8888 for more information""?",easy,True,extract_phone_number
"Can you extract the phone number from this text: ""Please call me at (555) 123-4567 tomorrow""?",easy,True,extract_phone_number
"hey i got this big list of contacts from last years club members but some of the numbers are typed out kinda weird like “(555) 123-4567” and a few like +1-555-234-5678 or just 5552345678 can you pull out all the phone #s for me? here’s the txt:

Hey, call Sam at (555) 123-4567 for the food details, or maybe try Jess at +1-555-234-5678. If no answer, reach out to Lee 5552345678. Also, don’t forget to check with Mo at ext.2345 but I’m not sure if that’s a phone.",hard,True,extract_phone_number
"Can u help me to find the phne numbr in this?: ""You can call me anytime at (555) 776-1234 or just email.""",hard,True,extract_phone_number
can u please find the phone #s in this ? here’s the text: Call me at 555-1234 or reach my office at (800) 999-1212. ok thnks,hard,True,extract_phone_number
"hey, could u pull out any phone numers from this? ""Contact me at office or my cell 555 231-8899 or maybe at the old number 800-442-0123 thanks""?",hard,True,extract_phone_number
"hi i have an emial that says ""call me at (555) 123 4567"" can u tell me what the phone number is?",hard,True,extract_phone_number
What is 101101 in base 2 when converted to base 8?,easy,True,convert_bases
What is 1101011 from base 2 in base 8?,easy,True,convert_bases
Can you change 11011 from binary (base 2) to hexadecimal (base 16)?,easy,True,convert_bases
What is the value of 110101 in base 8 if it's currently in base 2?,easy,True,convert_bases
Can you convert the number 10110 from base 2 to base 8?,easy,True,convert_bases
"i have 56 in base 7, can u turn it into base 12 for me?",hard,True,convert_bases
hey if i have 110010 in bianry i think its base2? how do i make that into base 8 (octalll)?,hard,True,convert_bases
"hey i got ""ZZZ"" but can you tell me what that is in base 8? thnks i think its base 36 or sumthin",hard,True,convert_bases
i have this numbr 111101 and i thik its base2 can u tell me what it is in base 8?,hard,True,convert_bases
"I try to change 1011 from base 2 to 8, but i not sure how its work. what it shoud be?",hard,True,convert_bases
How many feet are in 3 meters?,easy,True,unit_conversion
How many miles are in 10 kilometers?,easy,True,unit_conversion
How many kilometers are there in 5000 meters?,easy,True,unit_conversion
How many kilometers are in 500 miles?,easy,True,unit_conversion
How many pounds are there in 20 kilograms?,easy,True,unit_conversion
hey how many feets is 169 meter? i thikn i got the unit wrong last time.,hard,True,unit_conversion
how many ft is 100 metets? is that longer then a mile??,hard,True,unit_conversion
how many lbs is 80 kg? i need to know if my suitcase is gonna be over the limit,hard,True,unit_conversion
ok so if i have 38 c like with fever whts that in fahrenhiet??,hard,True,unit_conversion
how many pond is 5 kilo? i dont rember the conversion ratio,hard,True,unit_conversion
How much is 100 USD in EUR?,easy,True,convert_currency
How much is 150 GBP in USD?,easy,True,convert_currency
How much is 50 GBP in JPY?,easy,True,convert_currency
How much is 250 USD in JPY?,easy,True,convert_currency
How much is 200 GBP in JPY?,easy,True,convert_currency
"hi, can u pls tell me how many euro will i get if i have 250 usd?",hard,True,convert_currency
how much is 150 USD in jpY?,hard,True,convert_currency
"hey, how muh is 250.45 eurs in usd right now?",hard,True,convert_currency
i have 300usd how much is that in JPY?,hard,True,convert_currency
"uhh if I got like 27,50 euro how much is that in usd??",hard,True,convert_currency
What's the weather like right now in Paris?,easy,True,get_weather
What’s the weather like right now in Paris?,easy,True,get_weather
What’s the weather like in Tokyo right now?,easy,True,get_weather
What is the current weather in Paris?,easy,True,get_weather
What's the weather like in Tokyo right now?,easy,True,get_weather
"Hey, whats the wether like in londoon right now?",hard,True,get_weather
what temp in new yrok rite now?,hard,True,get_weather
whta does it look like outside in tokyo today,hard,True,get_weather
can u tell me what the weaher is in london right now? i wanna knwo if its rainng or suny thx,hard,True,get_weather
wats the weather in newyork today plz?,hard,True,get_weather
What's the current price of TSLA stock?,easy,True,fetch_stock_price
What's the latest price for GOOGL?,easy,True,fetch_stock_price
What's the latest price for TSLA?,easy,True,fetch_stock_price
What is the current price of MSFT stock?,easy,True,fetch_stock_price
What's the current stock price for MSFT?,easy,True,fetch_stock_price
what’s msft stock price rightnow?,hard,True,fetch_stock_price
hey can you get me the currnt price for msft? is that the correct symbol or ubt? thanks,hard,True,fetch_stock_price
"hey, can u tell me how much is TSLA stock price right now? is it up or down?",hard,True,fetch_stock_price
hey so how much is tesa stock at the momnent? I think the symbol is tesla or TSAL?,hard,True,fetch_stock_price
Hey can u check what thelastest price for msft is rn?,hard,True,fetch_stock_price
What is the current price of ETH?,easy,True,fetch_crypto_price
What's the current price of ETH?,easy,True,fetch_crypto_price
What's the current price of ADA?,easy,True,fetch_crypto_price
What's the latest price of ADA?,easy,True,fetch_crypto_price
What's the current price of ETH?,easy,True,fetch_crypto_price
how much does BTC cost rightnow?,hard,True,fetch_crypto_price
"hey, can u tell me whats the currentprce of ethh??",hard,True,fetch_crypto_price
what eth worth now?,hard,True,fetch_crypto_price
Hi can you tell me what is the lates prcie for bitcoin right now?,hard,True,fetch_crypto_price
